<?xml version="1.0" encoding="UTF-8"?>

<?xml-stylesheet type="text/xsl" href="actividad2.4.xslt"?>
<!DOCTYPE Pedidos SYSTEM "file:/C:/LnguajeMarcasHito2/esquema.dtd">
<Pedidos>
  <!-- primer trimestre de2021 -->
    <!-- Pedidos recurrentes -->
  <Pedido>
    <NumeroPedido>1001</NumeroPedido>
    <FechaCompra>2021-01-05</FechaCompra>
    <FechaEntrega>2021-01-10</FechaEntrega>
    <TotalFactura>99.99</TotalFactura>
    <Producto>
      <NombreProducto>Zapatos de running Nike Air Zoom Pegasus 37</NombreProducto>
      <Referencia>NKZP001</Referencia>
      <Precio>119.99</Precio>
      <Unidades>1</Unidades>
    </Producto>
    <Clientes>
      <DatosPersonales>
        <Nombre>Luis</Nombre>
        <Apellidos>Gómez Pérez</Apellidos>
        <Telefono>987654321</Telefono>
        <Direccion>
          <Calle>Calle del Sol, 123</Calle>
          <Ciudad>Madrid</Ciudad>
          <CPostal>28001</CPostal>
          <Provincia>Madrid</Provincia>
        </Direccion>
        <FechaInclusion>2020-12-20</FechaInclusion>
        <Email>luis.gomez@example.com</Email>
      </DatosPersonales>
    </Clientes>
  </Pedido>
  <Pedido>
    <NumeroPedido>1002</NumeroPedido>
    <FechaCompra>2021-02-15</FechaCompra>
    <FechaEntrega>2021-02-20</FechaEntrega>
    <TotalFactura>329.95</TotalFactura>
    <Producto>
      <NombreProducto>iPhone 12 Pro Max 256GB</NombreProducto>
      <Referencia>IPH001</Referencia>
      <Precio>1299.00</Precio>
      <Unidades>1</Unidades>
    </Producto>
    <Clientes>
      <DatosPersonales>
        <Nombre>Ana</Nombre>
        <Apellidos>Ruiz Martínez</Apellidos>
        <Telefono>123456789</Telefono>
        <Direccion>
          <Calle>Avda. de la Paz, 67</Calle>
          <Ciudad>Barcelona</Ciudad>
          <CPostal>08002</CPostal>
          <Provincia>Barcelona</Provincia>
        </Direccion>
        <FechaInclusion>2020-11-25</FechaInclusion>
        <Email>ana.ruiz@example.com</Email>
      </DatosPersonales>
    </Clientes>
  </Pedido>
  <Pedido>
    <NumeroPedido>1003</NumeroPedido>
    <FechaCompra>2021-03-05</FechaCompra>
    <FechaEntrega>2021-03-10</FechaEntrega>
    <TotalFactura>89.99</TotalFactura>
    <Producto>
      <NombreProducto>Levi's 501 Original Fit Jeans</NombreProducto>
      <Referencia>LVS001</Referencia>
      <Precio>89.99</Precio>
      <Unidades>1</Unidades>
    </Producto>
    <Clientes>
      <DatosPersonales>
        <Nombre>Miguel</Nombre>
        <Apellidos>García López</Apellidos>
        <Telefono>987123456</Telefono>
        <Direccion>
          <Calle>Calle Mayor, 45</Calle>
          <Ciudad>Sevilla</Ciudad>
          <CPostal>41001</CPostal>
          <Provincia>Sevilla</Provincia>
        </Direccion>
        <FechaInclusion>2021-02-01</FechaInclusion>
        <Email>miguel.garcia@example.com</Email>
      </DatosPersonales>
    </Clientes>
  </Pedido>
  <Pedido>
    <NumeroPedido>1004</NumeroPedido>
    <FechaCompra>2021-03-20</FechaCompra>
    <FechaEntrega>2021-03-25</FechaEntrega>
    <TotalFactura>229.00</TotalFactura>
    <Producto>
      <NombreProducto>Samsung Galaxy Watch 3</NombreProducto>
      <Referencia>SMW001</Referencia>
      <Precio>229.00</Precio>
      <Unidades>1</Unidades>
    </Producto>
    <Clientes>
      <DatosPersonales>
        <Nombre>Elena</Nombre>
        <Apellidos>Rodríguez Sánchez</Apellidos>
        <Telefono>654987321</Telefono>
        <Direccion>
          <Calle>Calle Gran Vía, 89</Calle>
          <Ciudad>Madrid</Ciudad>
          <CPostal>28013</CPostal>
          <Provincia>Madrid</Provincia>
        </Direccion>
        <FechaInclusion>2021-01-10</FechaInclusion>
        <Email>elena.rodriguez@example.com</Email>
      </DatosPersonales>
    </Clientes>
  </Pedido>
  <Pedido>
    <NumeroPedido>1005</NumeroPedido>
    <FechaCompra>2021-03-30</FechaCompra>
    <FechaEntrega>2021-04-04</FechaEntrega>
    <TotalFactura>799.00</TotalFactura>
    <Producto>
      <NombreProducto>PlayStation 5</NombreProducto>
      <Referencia>PS5001</Referencia>
      <Precio>799.00</Precio>
      <Unidades>1</Unidades>
    </Producto>
    <Clientes>
      <DatosPersonales>
        <Nombre>Pablo</Nombre>
        <Apellidos>Martínez Pérez</Apellidos>
        <Telefono>789123654</Telefono>
        <Direccion>
          <Calle>Paseo de la Castellana, 12</Calle>
          <Ciudad>Madrid</Ciudad>
          <CPostal>28046</CPostal>
          <Provincia>Madrid</Provincia>
        </Direccion>
        <FechaInclusion>2021-02-05</FechaInclusion>
        <Email>pablo.martinez@example.com</Email>
      </DatosPersonales>
    </Clientes>
  </Pedido>
  <!-- Pedidos no recurrentes -->
  <Pedido>
    <NumeroPedido>1006</NumeroPedido>
    <FechaCompra>2021-01-10</FechaCompra>
    <FechaEntrega>2021-01-15</FechaEntrega>
    <TotalFactura>149.99</TotalFactura>
    <Producto>
      <NombreProducto>Camisa Ralph Lauren Classic Fit</NombreProducto>
      <Referencia>RAL001</Referencia>
      <Precio>149.99</Precio>
      <Unidades>1</Unidades>
    </Producto>
    <Clientes>
      <DatosPersonales>
        <Nombre>Carlos</Nombre>
        <Apellidos>Fernández García</Apellidos>
        <Telefono>654321987</Telefono>
        <Direccion>
          <Calle>Calle Mayor, 67</Calle>
          <Ciudad>Barcelona</Ciudad>
          <CPostal>08003</CPostal>
          <Provincia>Barcelona</Provincia>
        </Direccion>
        <FechaInclusion>2020-12-15</FechaInclusion>
        <Email>carlos.fernandez@example.com</Email>
      </DatosPersonales>
    </Clientes>
  </Pedido>
  <Pedido>
    <NumeroPedido>1007</NumeroPedido>
    <FechaCompra>2021-01-20</FechaCompra>
    <FechaEntrega>2021-01-25</FechaEntrega>
    <TotalFactura>499.00</TotalFactura>
    <Producto>
      <NombreProducto>MacBook Air M1</NombreProducto>
      <Referencia>MAC001</Referencia>
      <Precio>999.00</Precio>
      <Unidades>1</Unidades>
    </Producto>
    <Clientes>
      <DatosPersonales>
        <Nombre>María</Nombre>
        <Apellidos>González López</Apellidos>
        <Telefono>987321654</Telefono>
        <Direccion>
          <Calle>Calle Gran Vía, 34</Calle>
          <Ciudad>Madrid</Ciudad>
          <CPostal>28013</CPostal>
          <Provincia>Madrid</Provincia>
        </Direccion>
        <FechaInclusion>2020-11-20</FechaInclusion>
        <Email>maria.gonzalez@example.com</Email>
      </DatosPersonales>
    </Clientes>
  </Pedido>
  <Pedido>
    <NumeroPedido>1008</NumeroPedido>
    <FechaCompra>2021-02-01</FechaCompra>
    <FechaEntrega>2021-02-06</FechaEntrega>
    <TotalFactura>299.95</TotalFactura>
    <Producto>
      <NombreProducto>Bose QuietComfort 35 II</NombreProducto>
      <Referencia>BQC001</Referencia>
      <Precio>299.95</Precio>
      <Unidades>1</Unidades>
    </Producto>
    <Clientes>
      <DatosPersonales>
        <Nombre>David</Nombre>
        <Apellidos>López Rodríguez</Apellidos>
        <Telefono>789654123</Telefono>
        <Direccion>
          <Calle>Paseo de la Castellana, 56</Calle>
          <Ciudad>Madrid</Ciudad>
          <CPostal>28046</CPostal>
          <Provincia>Madrid</Provincia>
        </Direccion>
        <FechaInclusion>2021-01-05</FechaInclusion>
        <Email>david.lopez@example.com</Email>
      </DatosPersonales>
    </Clientes>
  </Pedido>
  <Pedido>
    <NumeroPedido>1009</NumeroPedido>
    <FechaCompra>2021-02-10</FechaCompra>
    <FechaEntrega>2021-02-15</FechaEntrega>
    <TotalFactura>399.00</TotalFactura>
    <Producto>
      <NombreProducto>Sony WH-1000XM4</NombreProducto>
      <Referencia>SNY001</Referencia>
      <Precio>399.00</Precio>
      <Unidades>1</Unidades>
    </Producto>
    <Clientes>
      <DatosPersonales>
        <Nombre>Laura</Nombre>
        <Apellidos>Martínez Ruiz</Apellidos>
        <Telefono>654789123</Telefono>
        <Direccion>
          <Calle>Calle Mayor, 78</Calle>
          <Ciudad>Barcelona</Ciudad>
          <CPostal>08004</CPostal>
          <Provincia>Barcelona</Provincia>
        </Direccion>
        <FechaInclusion>2020-12-01</FechaInclusion>
        <Email>laura.martinez@example.com</Email>
      </DatosPersonales>
    </Clientes>
  </Pedido>
  <Pedido>
    <NumeroPedido>1010</NumeroPedido>
    <FechaCompra>2021-03-10</FechaCompra>
    <FechaEntrega>2021-03-15</FechaEntrega>
    <TotalFactura>699.00</TotalFactura>
    <Producto>
      <NombreProducto>LG OLED CX 55"</NombreProducto>
      <Referencia>LGO001</Referencia>
      <Precio>699.00</Precio>
      <Unidades>1</Unidades>
    </Producto>
    <Clientes>
      <DatosPersonales>
        <Nombre>Alberto</Nombre>
        <Apellidos>Ruiz Pérez</Apellidos>
        <Telefono>987456321</Telefono>
        <Direccion>
          <Calle>Calle Gran Vía, 123</Calle>
          <Ciudad>Madrid</Ciudad>
          <CPostal>28013</CPostal>
          <Provincia>Madrid</Provincia>
        </Direccion>
        <FechaInclusion>2020-11-10</FechaInclusion>
        <Email>alberto.ruiz@example.com</Email>
      </DatosPersonales>
    </Clientes>
  </Pedido>

   <!-- segundo trimestre de 2021 -->


  <!-- Pedidos recurrentes -->
  <Pedido>
    <NumeroPedido>1001</NumeroPedido>
    <FechaCompra>2021-04-05</FechaCompra>
    <FechaEntrega>2021-04-10</FechaEntrega>
    <TotalFactura>79.99</TotalFactura>
    <Producto>
      <NombreProducto>Samsung Galaxy Buds+</NombreProducto>
      <Referencia>SMG001</Referencia>
      <Precio>79.99</Precio>
      <Unidades>1</Unidades>
    </Producto>
    <Clientes>
      <DatosPersonales>
        <Nombre>Luis</Nombre>
        <Apellidos>Gómez Pérez</Apellidos>
        <Telefono>987654321</Telefono>
        <Direccion>
          <Calle>Calle del Sol, 123</Calle>
          <Ciudad>Madrid</Ciudad>